{
  "id": "simple_item_16",
  "canvas": {
    "width": 16,
    "height": 16
  },
  "kind": "item_icon",
  "output_files": [
    "textures/item/{asset_id}.png"
  ],
  "rules": {
    "palette_required": "yes",
    "mask_required": "yes",
    "allow_partial_alpha": "no",
    "transparency_mode": "binary",
    "mixel_policy": "strict",
    "readability_hint": "High silhouette readability at inventory scale.",
    "anti_mixel_passes": 2,
    "notes": [
      "Use for small inventory icons.",
      "Silhouette and readability matter more than micro-detail."
    ]
  }
}
